{
  "version": "1.0.0",
  "generatedAt": "2025-12-07T08:21:45.082053+00:00",
  "sourceFormat": "xml",
  "ideologies": [
    {
      "id": "IDE001",
      "name": "Fascism",
      "description": "An authoritarian ultranationalist political ideology characterized by dictatorial power, forcible suppression of opposition, and strong regimentation of society and the economy",
      "principles": [],
      "attributes": {
        "authoritarianism_Level": 0.9,
        "economic_Control": 0.8
      }
    },
    {
      "id": "IDE002",
      "name": "Communism",
      "description": "A philosophical, social, political, and economic ideology focused on the establishment of a classless, moneyless society based on common ownership of the means of production",
      "principles": [],
      "attributes": {
        "economic_Equality": 0.9,
        "state_Control": 0.7
      }
    },
    {
      "id": "IDE003",
      "name": "Liberalism",
      "description": "A political and moral philosophy based on liberty, consent of the governed, and equality before the law",
      "principles": [],
      "attributes": {
        "economic_Freedom": 0.8,
        "individual_Liberty": 0.9
      }
    }
  ]
}
